name,line
 Yelan," I've been in my fair share of treacherous battles. So I know full well that you never bring up extreme measures like this until the very, very end."
 Xiao, ...
 Yelan," You say these things in the hope that we will understand and accept them. But if you don't even know that your self-sacrifice is going to pay off, all you're doing is hurting morale."
 Yelan," Besides, if you were really so determined to end it all, you wouldn't have given us the opportunity to share our opinions. You think you're oh-so cold and ruthless, but I'm not buying it."
 Yelan," And anyway, losing one of us so the rest can escape? Some victory that is."
 Yanfei, Yelan... Don't be so harsh...
 Yelan, ...
 Yelan," Point is, it's not time for drastic measures yet. It's possible there's a hidden passage leading to the exit that we just haven't discovered."
 Xiao," What if there isn't? Or if we don't find it? And in the end, I'm so weak that I don't have the strength left to sacrifice myself... what do you propose we do then?"
 Yelan," As things stand, there's no difference between sacrificing you and trying to find another way out in terms of the likelihood of success. If we can't say that one strategy is better than the other, we certainly shouldn't be rushing into a risky course of action."
 Xiao, Ugh! ...*cough*
 Xiao," Enough... phantom, be gone!"
 Paimon," Xiao, are you okay?"
Traveler, You haven't even recovered from your injuries yet...
 Xiao, This is my purpose. Don't worry about me.
 Yelan," So your invisible opponent was the legendary Bosacius, Marshal Vritras?"
 Xiao, Yes.
 Xiao, So excuse my stubbornness. Bosacius has been missing for centuries... This may have been the last time I will ever see him.
 Paimon, He was saying something about holding the line at all costs...
 Xiao, He fought here. The nameless yaksha from the legends... it was him.
 Paimon, But didn't you say he'd always announce his name? How could his name be lost to time? ...What happened?
 Xiao, ...
 Xiao, I don't know. Maybe he forgot who he was.
 Yanfei, Because the karma you spoke of drove him to madness?
 Xiao, Bosacius had already gone mad before he disappeared. There was no way of knowing if his memories were intact.
 Yelan," He still took part in the battle of The Chasm, despite having gone mad?"
Traveler, ...
 Xiao, We yakshas are not a race that thrive in peacetime. It's likely that he was drawn by the scent of bloody war.
 Xiao, Slaughter is what we do best... Maybe it's the only thing we know.
Traveler, ...
 Xiao," This battle confirmed my suspicions. As we had speculated, this space reflects information from people's minds."
 Xiao," In other words, despite going mad, Bosacius came here. The illusion we saw just now is the impression he left behind."
 Xiao, This space recreated him as he was during the battle. The way he fought was so self-destructive... He couldn't possibly have survived.
Traveler, He fought the monsters...
 Yelan, Bosacius's illusion said he'd discovered the monsters' weakness and lured them underground.
 Yelan," What kind of place could this be? Defeating Khaenri'ah's monsters is no small feat, that's for sure."
 Yanfei," Guys, it could just be me, but... I think I'm suddenly feeling more tired than I was."
 Yelan, This space is really starting to affect us.
 Xiao," I believe Bosacius stayed here, underground. But now he is gone, and only his illusion remains."
 Xiao," If we don't leave, we may meet the same fate."
Traveler, Let's go.
 Xiao, Time to move on.
 Xiao," You fought well, Bosacius. Goodbye."
Xiao, I will maintain the energy flow
Yelan, Understood
Xiao," Everyone, stand back"
Bosacius, I shall hold the line
Bosacius, By sealing the surface
Xiao, ...As yakshas
Xiao, We must fight for this world
Xiao, General Alatus
Xiao, Falling in!
 Zhongli, ...This trip may be dangerous
Zhongli, Yet you insist on going
Xiao, I have guarded this place for several hundred years
Xiao, Only to seek the nameless yaksha
Xiao, Do I request your approval
 Xiao, ...Hm.
 Yelan," I know what you were thinking, but..."
 Yelan, Never mind. I know I can't talk you out of a mindset that's been built up over a lifetime.
 Yelan," I don't think we were ever going to reach an agreement over the final strategy. But in the end, it was thanks to you that we managed to escape. So thank you for saving us all."
 Xiao, ...
 Xiao, No. I could not have done this on my strength alone.
 Yanfei," Maybe Yelan really doesn't believe she made a contribution. It seems like she's convinced Xiao saved us all... including her, and she doesn't know what to say to that."
 Yanfei, And since it's not easy to persuade Xiao of anything. Maybe Yelan's just given up trying to talk to him.
 Paimon," Xiao, she's criticizing you."
 Yanfei, Am not!
 Xiao, You speak only the truth. I have no quarrel with that.
 Xiao, I will keep your words in mind.
 Traveler,Hello...
 Xiao, You knew I was waiting for you?
Traveller," Yes, it was obvious."
 Xiao, ...Really...
 Xiao," There's somewhere I want to go. If you have the time, you can join me."
 Paimon, Where is it?
 Xiao, A place that has to do with the yakshas.
 Xiao, The temple up ahead was built to remember Pervases.
 Xiao, ...Maybe I came here because I had a realization.
 Traveler, You mean back when we were underground? What did you realize?
 Xiao, It's hard to put into words... Seeing Bosacius gave me the false impression that I'd traveled back into the past.
 Xiao," ...You could dress up the yaksha's life and call us valiant warriors, veterans of war, but... the truth is, we are slaughterers, and nothing more."
 Xiao," For Bosacius, perhaps dying in the heat of a great battle was no tragedy."
 Xiao, And perhaps the same is true for me. After living for so long... to die in the act of saving others would not have been a terrible thing.
Traveler, I think you know that that isn't true.
 Xiao, Mm. So maybe... these thoughts are my own form of insanity.
Traveler," Hey, don't say that..."
Traveler," Xiao, I've got something to tell you. It's very important."
 Xiao, Hmm?
 Traveler," You should spend our lives around the people who make us happiest.Maybe there aren't so many rules about how we should or shouldn't live our lives in this world after all. So... he hopes you can come to understand that even though the power of a yaksha may be harmful to other people, it doesn't mean you shouldn't hang out with them. There will always be someone willing to be by your side."
 Xiao," Hah. Suddenly, you sound a lot like Bosacius and the others."
 Xiao, They used to talk about how they hoped to live a mortal's life once the world was at peace. I think... I was the only one who didn't think that way.
 Xiao," The Bosacius recorded in the Fantastic Compass had lost his sanity. He addressed the people around him as ""Alatus,"" ""Menogias,"" and others. These are the names of the Five Yakshas."
 Xiao," I am Alatus, and Menogias is General Kapisas."
 Xiao," The others are Bonanus, or ""General Chizapus,"" and Indarias, or ""General Musatas."" I heard that people call the five of us ""Yakshas: The Guardian Adepti""... Hah."
 Xiao, Bosacius and Yelan's ancestor stayed underground to the end. So that space must have read their minds in their last moments as they approached death.
 Xiao," Yelan was right in everything she said. Both of our proposals had their drawbacks, and both were sensible suggestions. But the power of that space was far beyond all of us."
 Xiao," I couldn't have done all I did without everyone's help. Even in the final moments, it took every bit of my power to break free from that place..."
 Traveler, Well I still think you were amazing!
 Xiao," ...Yanfei and Yelan are correct. I always prepare for the worst-case scenario. This mindset is deeply rooted in me... Even so, it was the most optimistic solution I could think of."
 Xiao," If Rex Lapis hadn't saved me in that moment, I don't think I would've been able to escape."
Traveler, So that was Zhongli's power back there...
 Xiao," In the end, I still had to burden another."
 Traveler," But that's how it should be, right? You've known Zhongli... uh, Rex Lapis for such a long time, and you've helped him before. So he helped you back, what's the big deal? Supporting each other is how people survive."
 Xiao, ...Perhaps.
 Xiao," In the moment that we escaped from that space, I could sense what was left of Bosacius's memory. If I had to say what I gained from this trip, I think that would be it."
Traveler, I think I felt it too.
 Xiao, It's good that one more person will remember him.
 Xiao, I've said so much today. But I don't need to hold back as much when I talk to you.
 Xiao," Have you ever had a moment where you felt like you were aware of your destiny? The potential of life, the approach of death... whatever it might have been."
 Xiao," By now, I have accepted that destiny is the one disaster that the yaksha knows most keenly of all. We are destined to misery... and yet we have no fear."
Traveler, ...Xiao...Are you sure it's okay for you to tell me all this?
 Xiao, It matters not. Rex Lapis had said that you are a witness. It is right that the events of the world are relayed to you.
 Xiao," Bonanus, Menogias, and Indarias all perished, and only Bosacius's fate was unknown. This has always stung my heart like a thorn. That is why I went to The Chasm, despite being fully aware of the danger."
 Xiao," ...Now that I know what happened in The Chasm back then, I can finally put this matter to rest."
 Xiao," Before we left that place, I picked up a stone. I thought if I could take it out with me, I would place it in the temple to Pervases in memory of Bosacius."
 Xiao," Unfortunately, the stone did not survive."
 Xiao," Pervases died in the Archon War thousands of years ago. He was younger than us, and Bosacius was very sad when he passed."
 Xiao," Too many yakshas have become casualties of battle. We are like a flock of birds scattered to the four corners of the world. And in the end, as Bonanus said... it's rare for a yaksha to find repose for their soul."
 Xiao," Bosacius, Boyang, and all those soldiers..."
Traveler," No, Xiao... They are all heroes."
 Xiao, Heroes...
 Xiao, ...I like that word.
 Xiao," Maybe the world will never be free of disaster. But there is good in the world, too. Even the darkest hearts have room for those they cherish."
 Xiao," I accept your advice. From this day on, heroes will always look out for each other."
 Xiao, I was purging some living beings that had been tainted by the demonic. It would appear that I have caused you some trouble.
 Traveler," But you were exorcizing demons, how is that causing trouble?"
 Xiao," That is because the changes that occurred in these monsters stem from me — or more precisely, from the karma I have accumulated."
 Traveler," Mutations, karma... Does that mean...We read about that in the book...So Xiao is the final yaksha?"
 Traveler,I remember that Xiao is also called the Vigilant Yaksha...So... so that means... Aww...*sniff* P—Poor Xiao...
 Xiao, ...What are you doing here?
 Traveler, Huh? Xiao... Are you here for the festival?
 Xiao, I have no interest in Lantern Rite.
 Xiao, I sensed a malign influence here. I'm here to investigate.
 Xiao," When a shackle is loosened in the realms of deities and demons, I take full responsibility."
 Xiao," But this time, the threat comes from the mortal world — your world. Thus you shall take full responsibility, mortal traveler."
 Xiao," When the time comes, I hope you shall act promptly and decisively..."
 Xiao, I do not wish for the tassel of the polearm that has slaughtered countless demons to become stained with mortal blood.
 Traveler, What's this?
 Xiao, A symbol that your suspected evildoer left behind.
 Xiao," Well, you will have to show me how much you can accomplish on your own strength."
 Xiao," Because if I become involved, there is a possibility that the streets of Liyue Harbor will be painted red this Lantern Rite."
Traveler," Then it's up to me to avoid that... Actually, quite a festive color in this part of the world..."
Xiao, ...I am not partial to crowded areas. Especially at this time of the year.
 Xiao, When this matter is resolved... come to Wangshu Inn.
 Xiao," In previous years, the Mingxiao Lantern has been visible even from there."
 Xiao," So, is the matter resolved?"
Traveler," We took care of it, but—"
 Xiao, —Good.
Traveler, Are you really not going to see the Mingxiao Lantern?
 Xiao," No. As I said, I am not partial to crowded areas. Especially at this time of the year."
Traveler, The Mingxiao Lantern this year is Skybracer.
 Paimon," Yeah, it's a super impressive-looking giant deer, let's go take a look together!"
 Xiao," ""Skybracer..."""
 Xiao," Huh, a Mingxiao Lantern nonetheless. A fleeting creation of human hand. It means nothing to me."
 Xiao," If this short-lived spectacle is one you wish to witness, I suggest you go to the city. I, for one, have no interest in the Lantern Rite."
Traveler,"Ta-da! Your very own, miniature Lantern Rite festival! Well if it doesn't look mouth-watering..."
 Xiao, So this is what you meant by bringing the festival to me... *sigh* Is there no end to the peculiarities of human behavior?
 Xiao, Does this serve any grander purpose?
Traveler, This way you can take part in Lantern Rite.
Traveler, Lantern Rite is meant to include everyone.
 Xiao," ...Is that so? Hmph, human motives defy my attempts to fathom them."
Traveler, Nobody says you have to enter the city... You can just see us off at the outskirts.
 Xiao, ...
 Xiao, ...Hmph.
 Xiao, So be it. I shall accept your proposal.
 Traveler," There you go! Alright, time to hit the road!"
 Traveler,You are obviously one of the heroes this festival is all about... Why don't you wanna get involved?
 Xiao, I... detest the rabble.
 Xiao," No cares in the world, so peaceful, so joyful... They are nothing like me."
 Xiao," Too long have I spent slaughtering, accompanied by the burden of suffering that follows in its wake. Crossing paths with all those jubilant people will only make me..."
 Xiao, ...That's all I have to say.
 Xiao, Farewell.
Traveler, Are you sure you don't want to go with us?
 Xiao, Are you really so enamored with such trivial amusements?
  Zhongli, I see... so the important guest is the Conqueror of Demons. I've been looking forward to meeting you.
 Zhongli," The director didn't mention anything when she invited us. What a pleasant surprise... Gathered here with us tonight are not only young and accomplished individuals, but also the protector of Liyue's peace, Adeptus Alatus."
 Zhongli, To convene here with all of you is indeed a great honor.
 Xiao, Uhhh...
 Xiao," ...It's almost Lantern Rite, yet you took all the trouble coming here..."
 Zhongli, *sigh* The director has a way of making it difficult to decline...
 Xiao, Rex Lapis... May I ask what troubles you?
 Zhongli, The director asked me to buy sesame oil in preparation for the celebrations.
 Xiao, ...?
 Xiao, Then why would you... come all the way to Wangshu Inn...
 Zhongli, I had a pleasant chat with Chef Yanxiao and received some spices from him. And... see? Here's some matsutake and a portion of ham.
 Xiao, What about the sesame oil...
 Zhongli, Mm... It's a shame. I couldn't find the kind the director was looking for.
 Xiao," I'm sure you're exaggerating, Zhong— Ahem, Sir."
 Hu Tao," Ugh, there he goes again! Enough with the pleasantries. Go let our guest take a seat."
 Hu Tao," Everyone here today is well-known in their own field and has probably heard about one another to some extent. Some of us are even old acquaintances, so there's no need to be this formal."
 Hu Tao," I heard that the Conqueror of Demons and Traveler are pretty close, no?"
 Hu Tao, Great! You two sit together!
 Zhongli," You should take a seat too, Director."
 Hu Tao, Oh? Finally remembered me?
 Hu Tao," When we arrived just now, the hosts at Xinyue Kiosk told me our dishes are almost ready. Perfect timing."
 Hu Tao, Let's not wait any longer and ask them to bring out the food.
 Paimon, Paimon would've never guessed the person Hu Tao went to fetch was Xiao...
 Chongyun, That's also the first I've heard of (Traveler) and Paimon being friends with the Conqueror of Demons.
 Paimon, You know Xiao too?
 Chongyun," ""Knowing"" is a bit of an overstatement. I've always looked up to him."
 Chongyun," You might not know this, Paimon, but we exorcists have worked in close collaboration with the Conqueror of Demons for many generations, dispelling evil together, both in the open and from the shadows."
 Chongyun," Hard to imagine that thanks to Hu Tao, I've finally gotten the chance to meet him... Conqueror of Demons, I am honored to make your acquaintance."
 Xiao, Likewise.
 Xingqiu, It is a great honor indeed to have a chance to meet the legendary Conqueror of Demons. Chongyun has brought that name up quite a few times in the past.
 Xingqiu, I remember you mentioning wanting him to understand the importance of exorcists...
 Chongyun, Ahem!
 Xiangling," Uh, we know each other too!"
 Xiangling, He helped try my dishes during the Masterful Chefs cook-off!
 Xiangling," Hehe, I didn't think we'd have the chance to meet again. Happy Lantern Rite!"
 Xingqiu," No anecdote, however, compares to meeting you in person. I'm Xingqiu, Xiangling and Chongyun's friend. The pleasure is all mine."
 Paimon," Whoa, everyone's getting all formal and polite all of a sudden... Paimon doesn't know what she should say anymore..."
 Paimon," Uh, Adeptus Xiao... Mighty Conqueror of Demons! Please accept Paimon's greetings, too! Belated Happy Lantern Rite!"
 Xiao, There's no need to be so polite.
 Hu Tao, ...Tch!
 Hu Tao," You're right. This was meant to be a nice little get-together between friends, after all. Too much formality kills the atmosphere."
 Hu Tao," I didn't plan this gathering only for everyone to walk on eggshells, ai ya!"
 Paimon," What's your true intention, then...?"
 Hu Tao," A little get-together between friends, sipping the finest tea, and watching lanterns float into the sky. Bidding farewell to the past, and embracing the present with joy."
 Hu Tao, And that is something our consultant would say. I think it deserves a standing ovation.
 Zhongli," Indeed. Exceptional acting skills, Director."
 Hu Tao," As for me, I'm just here to have fun and treat everyone to something good!"
 Hu Tao, We all worked really hard this year. Whether traveling or guiding...
 Hu Tao," Cooking, helping with the family business, exorcising evil spirits, or conquering demons..."
 Hu Tao," And of course, our consultant, who's been helping out at the parlor every now and then."
 Hu Tao, Everyone has done some pretty amazing things.
 Hu Tao," As the one who brought everyone together, it goes without saying that I'm the one most deserving of praise!"
 Paimon," Huh. Sounds kinda self-important, but Paimon thinks it's pretty amazing that she managed to talk Xiao into coming... He rarely ever enters Liyue Harbor, after all."
 Traveler,I'm curious about how she did it.
 Xiao, It wasn't as complicated as you think.
 Hu Tao," ...Okay gotcha, thanks, boss lady!"
 Verr Goldet," It's not boss lady, just boss!"
 Verr Goldet, And there she goes... What a lively girl.
 Hu Tao, Conqueror of Demons! Adeptus Xiaaaaao!
 Hu Tao, Guardian of Wangshu Inn! Hero of Dihua Marsh!
 Hu Tao, I know you're thereeee!
 Xiao, Tch...
 Xiao, Quiet! Do not disturb the peace.
 Hu Tao," Sorry! But you wouldn't show up if I didn't yell your name, would you?"
 Xiao, ...I know you. You're the 77th Director of Wangsheng Funeral Parlor.
 Xiao, Is there something you need?
 Hu Tao," But despite our deep-rooted connection, it still took me quite a while to actually convince him."
Traveler, Was he worried about his karma?
 Hu Tao," You know him pretty well, huh?"
 Xiao," This matter is out of my control, so I need to be cautious."
 Hu Tao," True, but I've kept that in mind too! That's why everyone here today is in one way or another acquainted with elemental power."
 Hu Tao," Besides, it'll only be for a short while as we dine together. There won't be any lasting consequences."
 Xiao, But I didn't... expect there to be so many people.
 Xingqiu," There's no need to worry, Conqueror of Demons. We're not feeling anything unusual so far."
 Xingqiu," Our young exorcist over here is protected by his pure-yang energy, so he's probably the most resilient."
 Xiao, ...
Traveler,You seem pretty quiet today. Is everything okay?
Traveler, Not used to being around so many people?
 Xiao, I'm doing fine.
 Xiao," Not long ago... before Lantern Rite, I met an old friend."
 Xiao," Thanks to his help, things have been a lot more stable than before."
Traveler, That's good to hear. Give everything you don't eat to Paimon.
Hu Tao," Not to brag, but our consultant truly is impressive. His knowledge extends across the stars and the land, and there's nothing throughout history that he doesn't know."
 Hu Tao," From the sophisticated way he speaks, it's hard not to suspect that he could very well be an adeptus in disguise! Hehe."
Xiao, ...
 Hu Tao," Xiao, you're an adeptus! Do you think it might be possible?"
 Xiao, I...
 Xiao," ...Sorry, I'm only good at conquering demons. I'm afraid I don't have much knowledge in that matter."
 Xiao, Are you alright?
Traveler, I should be the one asking you that.
 Xiao, ...
 Xiao, I... it's hard to describe.
Traveler, Unfamiliar with gatherings like this?
 Xiao, It's not that.
 Xiao," There were those among the adepti who loved gatherings and idle chit chat. Sometimes, they would call up a few others for a drink. Even I got dragged along to their gatherings, many times."
 Xiao," The adepti all have their specialties, making most of them proud and arrogant. Everything they say is straight from the heart... It never gets too complicated."
 Xiao, But this time...
Traveler, I understand. It's all Zhongli's fault.
 Xiao, That's not what I meant!
 Xiao, Or perhaps I should say Zhong... Rex Lapis is really good at adapting to human life. You could say that he actually enjoys doing so.
Traveler, I understand. It's all Venti's fault.
 Xiao," N—No, I didn't mean that..."
 Xiao, So you know his true identity. I'll get straight to the point then.
 Xiao," The Anemo Archon is a free spirit, and his temperament is as carefree as the music he plays on the flute. It's easy for a god like him to live in harmony with humans..."
 Xiao, And that's something I might never be able to do.
Traveler, You don't have to be like them.
Traveler, You do you.
 Xiao, Hmm... That does sound like something you would say.
 Xiao, No matter. I know my circumstances.
 Xiao," Whenever I think of the ordinary conversations I've had with you, it feels... strangely novel."
Traveler, Strange in a good way?
 Xiao, Yes.
 Xiao," The parlor director went out of her way with the invitation, so it was difficult to turn her down. I had made mental preparations before agreeing to come."
 Xiao," She told me that all the guests today would be ""acquainted with elemental power,"" and I knew that you would be here."
 Xiao, But I didn't expect the other guests to be...
Traveler, No one would've guessed.
 Xiao, General Kapisas always said that we should live in the present and enjoy every pleasant surprise. Perhaps that's what I should do with what I'm feeling now.
 Xiao, ...But I think he meant designing clothes for those around him.
 Xiao," The clothes were intricately designed, but inconvenient to wear. Brother Bosacius never tried to hide his distaste in front of him."
 Xiao, Rex Lapis did like his designs and even collected quite a few. The outfit he wears now was also designed by General Kapisas himself.
 Xiao, I never saw him wear this during the war. I didn't expect him to start wearing it later.
 Xiangling," Oh, here you are!"
 Xiangling," Um, I'm not intruding, right..."
 Xiao, You're not. What is it?
 Xiangling, Hu Tao saw that everyone's done eating and asked the staff to bring out the desserts.
 Xiangling, Paimon got so anxious that you weren't back yet that she scarfed down her dessert without the usual slurping and munching.
Traveler, But not so anxious that she can't eat. Sounds like she'll be okay.
 Xiangling," To be honest, I was kinda worried too."
 Xiangling," You looked a little restless just now, and I thought you weren't used to the food here and was planning to head back to Wangshu Inn for something Yanxiao made."
 Xiao, You're worrying too much.
Traveler," Xiao, don't pull any Lemniscatic Wind Cyclings on us."
 Xiao, ...Why would I.
 Xiao," Anyway, let's head back."
 Xiangling, Please wait!
 Xiangling, There's another reason why I came looking for you.
 Xiangling," Here, take these. I brought them for you!"
 Xiao, ...Almond Tofu?
 Xiangling, Yup!
 Xiangling," Since the Masterful Chefs competition, you could say that Yanxiao and I are not only competitors, but good friends as well! I visit him at Wangshu Inn sometimes to discuss our cooking."
 Xiangling," I heard him say that the esteemed guest on the roof loves nothing more than a good plate of Almond Tofu, so I learned a thing or two about the dish from him."
 Xiangling," I'll be honest... Before Hu Tao invited everyone, she secretly came looking for me, told me about the guests she planned to invite, and asked me for some suggestions on what she should order."
 Xiangling, So I made a few servings of Almond Tofu for you guys in advance! Take them as a token of gratitude for your support.
 Xiangling," When I told Guoba that I was making these for you, he started eagerly running around the kitchen and helping a lot too!"
 Xiao," Thank you for the trouble, there was no need to..."
Traveler, Ahem...
Xiao, ...I'll take them. Thank you... and Guoba too.
Xiangling, You're welcome!
Xiangling," Oh, the Almond Tofu I made probably tastes and feels a little different from the type Yanxiao cooks. Please let me know if there's any improvements I should make!"
Xiao, Okay.
