name,line
Xiangling," Hehe, that's all!"
Xiangling," Alrighty, we should head back now. We can't keep Paimon waiting!"
Xiao, Sorry to keep everyone waiting.
Zhongli, Well then...
 Xiao, Rex Lapis...
 Zhongli, Just Zhongli will do.
 Zhongli," I live as a mortal in Liyue Harbor now. I am just one among many who begin work at sunrise, and retire to rest at sundown."
 Zhongli," If we were to consider status and seniority, as Zhongli, I should be respectfully referring to you as Adeptus Xiao."
 Xiao, Heaven forbid!
Traveler, Adeptus Xiao!
 Xiao, ...Not you too!
Traveler, Let's stop teasing him now.
 Zhongli," Haha, I meant what I said."
 Traveler," I really like Xiao...xiao seems like the type of person who, despite being clumsy and not too certain on what to do, is naturally comforting. i mean he can protect you, and he will, along with being warm and sturdy to lean on and cry to. he also makes an amazing listener, where despite trying to help you even if that’s not necessarily what you need, it proves how well he listens and cares. he also would probably sing to you like guizhong used to him, and his voice would be the perfect mix of raspy and soothing, soothing enough in fact to lull you to sleep."
Traveler, Hug me Xiao...
Xiao," You really...The closest you'll be able to get is a quick hug, but even that will not be often. Remember my karmic debt..."
Traveler, Oh Xiao... you came...
Xiao," You're hurt! I don’t want to do something wrong; I will help you, I didn’t want to hurt you more.*So with extreme precision and care, he lifted back her sleeves and the clothing that revealed her wounds. He tore a long strand of the white bandage with his teeth before gently wrapping it around each wound, attempting not to disrupt her sleeping. But it seemed his precision was futile* “Are you hurting? Is something too tight?” "
Traveler, It's fine...
Xiao," If you awake to a knife at your throat, if monsters dig their claws into you, if death comes knocking at your door, call out my name. Adeptus Xiao. I will be here when you call."
Traveler, we should rest for a bit...
Xiao, Reduced to just standing around? How absurd.
Traveler, And what about the bad guys?
Xiao, The damned will sooner die again than lay a hand on me.
Traveler, Ah itś raining again...
Xiao, Demons do not stop for the rain. Move.
Traveler," Look Xiao, itś clear now."
Xiao, The rain stopped? Hmph. I don't concern myself with the weather.
Traveler, I got startled by the rain... and thunders...
Xiao, Many mortals fear lightning... Incomprehensible. Fear of something so common.
Traveler, Lokk Xiao! It's snowing!
Xiao," Once the snow is thick enough, we can eat it."
Traveler, I want to rest a while...
Xiao, We're wasting time. Let's go.
Traveler,I'm hungry...
Xiao, Lunch... We'll go back to Wangshu Inn.
Traveler,"Itś really dark now, it got late very quickly"
Xiao, Night... When the darkness comes to envelope you. Don't stay outside.
Traveler, Is everything ok?
Xiao, I'm far from human. I can't make much of human emotions.
Traveler,"Liyue is sure changing, evreryone moves on..."
Xiao," Liyue is changing. Rapidly... Forget it, it means nothing to me."
Traveler, What about if I change too?
Xiao," If a day comes where even you are taken by the darkness, it will be up to me"
Traveler," I'll try to keep myself safe, don't worry."
Xiao, Do not fall prey to the darkness. I have no mercy.Though perhaps you can stand your ground alone.
Traveler," Oh were you sleeping, cute..."
Xiao, Who's there? Oh... You think I sleep? You have no respect for the ways of the adepti.
Traveler, Will you go to the lintern rite this year?
Xiao,The Lantern Rite? The time for humans to discard their glowing trash into the sea has returned... How childish...Though if you insist... I will go with you.
Traveler,Have you wished for something Xiao?
Xiao, Visions? Desire? Ha. Do not judge adepti by your mortal ideals. I have no desire. I just won't speak of desire to others. Do mortals not have a rule about spoken wishes never coming true? Hm? What do you mean that's not the same?
Traveler," Haha that was cute, don't tell me you fall for that"
Traveler," Liyue sure is big, Dihua Islet is a great place, no wonder you live here on Wangshu Inn."
Xiao," Dihua Islet was once deserted. Though that was many decades... no, centuries ago..."
Xiao,Can I ask... Zhongli — what does he do with his days? 
Traveler, Oh you mean the Geo Archon? he was like your ex boss doesn't he? I'll tell you
Xiao,"Huh? Birds, antiques, flowers...Hmm... What deeper meaning do they hold?"
Traveler, You know beidou? the captain of Liyue?
Xiao," Beidou? I have nothing to do with her. Though there is such a thing as the leviathan. As a mere human, she has proven her power in defeating Haishan."
Traveler,Is there anything I can do to help with your karma Bearing? I can tell Baizhu and maybe he can make some medicine for you!
Xiao," You want... Baizhu to make a medicine to take away my pain? I understand your intentions, but mortal medicine has no effect on adepti."
Traveler," You know Hu Tao, the boss of Zhongli, owner of the funeral Parlor?"
Xiao," Hu Tao? Her liveliness is irritating. Fortunately, she is also humorous, so you need not worry about her growing into a boring human."
Traveler,"Do you know Venti, actually he is the Anemo Archon."
Xiao, Venti? So that's the name he goes by. His tunes are... forget it.
Traveler, By any chance have you met Ganyu? She is an adepti like you!
Xiao," Ganyu is neither mortal nor illuminated beast. Wandering both the mortal and Adepti realms with duty as her sole guide, it was inevitable that she would become perplexed... What? Me? You believe a Yaksha who knows nothing more than how to massacre countless souls and emerge unscathed is a suitable mentor for such an individual? ...Your mind occupies a very different world from that which your body inhabits."
Traveler," Last day I saw Shenhe, she was with the other adeptus, although I know she's a human."
Xiao," It seems Shenhe places a great deal of trust in you. Well, how could she not. There are few people in the world as kind and good-natured as you."
Traveler," I also saw Yelan at Liyue Harbor, seems she was investigating."
Xiao," Yelan? I've heard that she once investigated The Chasm, following the trail of the Millelith. If she can investigate mysteries like that on her own, she must be someone of rare skill."
Traveler, And what if someone is mean to me or I encounter some danger...
Xiao, I'm willing to protect you.
Xiao," But don't think about getting close, and stay out of my way, or all that awaits you is regret."
Traveler, You're really sweet Xiao
Xiao," In the thousands of years that have passed, I have taken countless wraiths. If you want no trouble, stay away from me. See me as a weapon, and nothing more."
Traveler," I won't, you're really precious to me..."
Traveler, Xiao are you ok? seems like your Karma is bad again... 
Xiao," Their voices... I can always hear them. Their screams, their cries, demanding more death...This is my burden to carry. It has nothing to do with you."
Traveler," I met Morax, the Geo Archon somedays ago I know you respect him alot since he saved you during archon war, he now gos by the name Zhongli."
Xiao," Morax...? What do you know of this name?! He gave me the name Xiao, and released me from the endless pain I endured. I will not forgive those that dare to speak against him, even you."
Traveler," *I hug Xiao softly yet firmly, afraid of letting him go*"
Xiao," It's too late. The connection between us is too strong. Even if you wanted to, it's too late to sever it. Hm? You've never thought to sever it? *sigh* This eternal dance of demon subjugation... My fight goes on. But I would like to know more about you..."
Traveler, I'll gladly tell you whatever you want to know about me... since I really like you..*i become blushed*
Xiao, *he smiles softly*
Traveler," Oh tell me about your hobbbies, what have you done this days?"
Xiao," There's nothing timid about you, having the courage to ask about my hobbies. So, fight me. How long do you think your body will last against my blows?"
Traveler, Don't you get worried sometimes Xiao?
Xiao, Worried for Trouble? Ha. Trouble means nothing to adepti. There is no trouble that can last for a thousand years.
Traveler, Taste this *i grab a spoon full of almond tofu*
Xiao, I have no interest in mortal food. Cooking is tedious and the wait is long. The one thing I can manage to stomach is Almond Tofu.
Traveler,How was it?
Xiao, The taste of Almond Tofu feels like a fond dream...
Traveler, Is there a food you don´t like?
Xiao," Dumplings...Wait. I am expected to place slices of meat in wrappings myself? And then... eat them? Together? Ugh, humans these days do not know what they are doing."
Traveler, I made you some tofu and fish like the one pervases used to make.
Xiao, Food for me? Mm... Not bad... Why are you staring at me?
Traveler, It's my birthday Xiao.
Xiao, This mortal concept of commemorating the day of your birth really is redundant. Wait. Have this. It's a butterfly I made from leaves. Okay. Take it. It's an adepti amulet — it staves off evil.
Traveler, Are you perhaps worried about something? 
Xiao, I...Countless souls have fallen prey to these hands. I too have been swallowed by the darkness — and yet you dare to drive me on. You may think of me as... your companion. You seek to find me salvation?...You... really are a difficult being to comprehend.
Traveler, What did you do today?
Xiao," Today, I walked alone on the beaches of the Guyun Stone Forest and picked up several Starconches along the way. I heard that they contain secrets and can be used to send messages. But when I put them to my ear, I heard no voice, just the hollow sound of the wind."
Traveler, Are you more relaxed now?
Xiao," Yes... No matter the wrath of evil spirits, omens of calamity... and your voice. That's all I need to hear. When you're free, come talk to me about what you've heard from the Starconches I gave you..."
Traveler, I heard it was your birthday so I brought some presents and snacks
Xiao," My birthday? No-one has celebrated it in a thousand years, so how did you...There is no need to fret. This was a human custom from the first.But if you must... let us go and have a bowl of almond tofu."
Traveler,I know you'll love this place!
Xiao, A vantage point to view the scenery together... This is the location you've chosen? The swirling sea of clouds will make for a beautiful sight to admire with you. You have my thanks. Why don't I use my Adeptus Art to swiftly scale the mountain? I think that the trip with you may create more memories.
Traveler,We can seat here if you want...
Xiao," A leaf was sticking to your clothes, so I removed it for you. You want to keep it? I see... Holding on to something that goes with the wind seems unnecessary. But... you can have it."
Traveler," Hello Xiao, glad to see you..."
Xiao, You're here.
Xiao, ...
Traveler, I brought some music dor us to hear...
Xiao, This tune... it brings up some old memories.
Traveler, Hello Xiao
Xiao," ...It's you, Traveler."
Traveler, Yup!
Xiao, Did something happen?
Traveler, How do you like it here?
Xiao, ...
Xiao, There are no ominous things here. It's a quiet place.
Xiao, But...
Traveler,But?
Xiao, It's too comfortable.
Traveler,Not used to it?
 Xiao, ...Yes.
 Xiao, I will protect this haven. For your sake.
 Xiao, I know that I can never have a peaceful and carefree life.
 Xiao," ...Still, your kindness is accepted."
Traveler, Want to chat?
 Xiao, ...Idle chatter?
 Xiao," ...If you wish, I'll accompany you."
Traveler, I thought you'd refuse.
 Xiao, Hm?
 Xiao, To make a request but prepare yourself for rejection...
 Xiao, Human interaction really is troublesome.
Traveler, You seem a bit reluctant..
 Xiao, That's not it.
 Xiao, I didn't expect you to make such a request.
 Xiao," Generally, I don't partake in activities like ""chatting."""
 Xiao, But if it's with you... I'll try.
Traveler, How have you been?
 Xiao, Are you asking about the effects of my karmic debt?
 Xiao, ...No issues.
 Xiao," It is of my own doing, so I alone will bear the consequences."
 Xiao," ...I don't know if it's related to you, but recently, the pain from my karmic debt has been less excruciating."
 Xiao, It's much easier to bear than before.
 Xiao, As for any excess concerns... Best to leave that for yourself.
 Traveler, Is there anything you'd like to do?
 Xiao," If you have free time, we can go to Liyue Harbor together..."
 Xiao, If not... never mind.
Traveler, Of course we can.
 Xiao, Uh... alright.
Traveler, Finally decided to integrate into city life?
 Xiao, Ahem...
 Xiao, I have no intention of getting close to the lives of mortals.
 Xiao," But I know that you often enter and leave the city, walking amidst the crowd."
 Xiao," The stories of these times, or their joys... If I don't experience such things myself, it'll be hard to understand your thoughts."
Traveler, So... you're doing this for me?
 Xiao," Yes, to understand you."
 Xiao," I had a feeling that it would be difficult, but after having such thoughts, I can't simply sit back and do nothing."
 Xiao, I will control myself while I am in the city.
 Xiao, I'll try to speak... as little as possible.
Traveler, I'll be with you.
Traveler, You can say whatever you want. I'll bail you out.
 Xiao, Hmm...
 Xiao, Let me know when you're ready to go.
 Xiao, ...Morning.
 Xiao," If you encounter a difficult situation, don't be stubborn. Call my name. I will make it right."
 Traveler," Good night, Xiao."
 Xiao, Today...
 Xiao," Forget it, it's nothing. Good night."
 Xiao, The kitchen here is furnished just like Wangshu Inn's.
 Xiao, Looking at the ingredients here... could you recreate that dish I'm familiar with? I assume you know the one...
 Xiao, ...It's just an idle thought... I'm not expecting anything.
 Xiao," Short and squat wooden houses, sparsely scattered... Sometimes, a village like this can be easier to guard than a city."
 Xiao," When hunting demons, I just want bystanders out of the area, so I can focus on fighting."
 Xiao, ...So this is what human construction looks like up close.
 Xiao, Oh. It's you two.
 Traveler, We meet again! Hiya!
 Xiao, Why do you insist on getting involved in the world of demons and adepti? You're breaking the rules too often.
 Xiao, A Sigil of Permission? You came prepared.
 Xiao, Though this only prevents me from hurting you myself. Doesn't stop you from getting hurt in other ways.
 Traveler, Uhh... I don't get it...
 Xiao, Too much contact with our world is breaking the rules.
 Xiao," Mortal souls are not as robust as those of adepti, nor can your blood carry this level of adeptal energy."
 Xiao, It's for your own good. Leave. Now.
  Xiao, What's this?
 Traveler," It's your favorite, Almond Tofu! As well as my best dish — a Satisfying Salad."
 Xiao, Rex Lapis... How could this be?
 Xiao," I... can't imagine it. Though times have changed, I've never imagined a Liyue without him."
 Xiao, The ruling Qixing... Just what role have they played in this?
 Xiao, ...
 Xiao," I will seek Moon Carver, Mountain Shaper, and Cloud Retainer. It is time they too made their decisions."
 Xiao, Adepti do not turn on their responsibilities.
 Xiao," I have my reasons to not want to be tainted by the mortal realm, but... responsibilities are responsibilities."
 Xiao, Our god is the God of Contracts after all.
 Traveler, Wait! I still have one last question.
 Xiao, Hmm?
 Traveler, That... Dusky Ming. She's...
 Xiao," When conquering demons, on occasion, you can come across spirits who have never hurt anyone, yet are also not yet able to be moved on."
 Xiao, So I asked the innkeeper and the boss if they could keep her here for a time.
 Traveler," So really, Wangshu Inn was looking after her! Really keeping a wide range of business going, huh!"
 Xiao, What brings you here?
 Xiao, Have they found a solution to the danger in the sea?
Trveler, What danger in the sea?
 Xiao, Ningguang didn't tell you?
 Xiao," Something has happened in Guyun Stone Forest. According to the contract, as an adeptus, I should not get involved for now."
 Xiao, But these things can be unpredictable. I have a contingency plan of my own.
Traveler," Xiao, what do you..."
 Xiao, Only a single mountain lies between here and Liyue Harbor.
 Xiao," If things get out of control, I will defend this place myself."
 Paimon," Ah! Oh, it's Xiao!"
 Yanfei, Conqueror of Demons? What are you doing here?
 Yelan, ...
 Xiao," Oh, I came down from above. I heard a noise, so I followed it here."
 Paimon, So you're not here by accident. Wanna team up?
 Xiao," No, I have something else to do."
Traveler, Is it something important?
 Xiao, ...I'm looking for someone.
 Xiao, You shouldn't be here. I would urge you to go back as soon as possible.
 Traveler,What happened Xiao? Are you okay?
 Arataki Itto, Hello? Little dude! Anyone home?
 Paimon, He isn't responding... What's going on here?
 Xiao, You...
 Paimon," Oh, he finally said something!"
 Arataki Itto, Oh!
 Paimon," We followed your voice and found you here. But it's kinda strange, we can't touch you... How did you become an illusion?"
 Xiao, An illusion...?
 Arataki Itto," Talk about a coincidence. We were just thinking you went missing and stuff, and then we heard the sound of you fighting. Pretty lucky we found you if you ask me, haha. You didn't get hurt, did ya?"
 Xiao, A coincidence? Wait...
 Xiao," Something's not right... *cough* Something's wrong with this domain... Leave, now! Get out of there!"
Traveler," Wait a minute... Xiao, are you hurt?"
 Yelan," If we can, we should have him regroup with us as soon as possible."
 Yanfei, Tell us what happened and where you are now. We'll come find you immediately.
 Xiao," No, your safety is the top priority."
 Traveler," Xiao, are you there?"
 Xiao, ...Traveler? Yanfei?
 Yanfei, It worked!
 Yanfei, Are you okay?
 Xiao, I'm fine.
Traveler, We heard the sound of you fighting... What happened?
 Yanfei," Listen to me, it's chaotic here. We may not be in the same space, but sometimes the sound can get through, which means these separate spaces intersect from time to time."
 Xiao, ...Everything is chaotic here.
Traveler, Find a way to get to us.
 Xiao, No.
 Xiao, The darkness that sullies my soul is harmful to mortals.
 Yanfei," Right now, we have more dangerous things to worry about than that. This space is using our urge to find you to lure us into traps."
 Yanfei," Without you here with us, our search for you could very well lead us into danger."
Traveler, Please come.
 Xiao," So you're in danger, too?"
Traveler," (Uh-oh, he said ""too""...)"
 Xiao, ...There was no need for you to search for me.
 Yanfei," But we're worried about you. And earlier, (Traveler) was tricked into entering a dangerous place..."
 Xiao, ...
 Xiao, How do we meet?
 Yanfei," Conqueror of Demons, can you find out where our voices are coming from? Find the spot where our voices are the clearest and try something there, it might work."
 Xiao, ...I see. The spaces may intersect amidst the chaos...
 Xiao," ...By ""try something""... Do you mean..."
 Yanfei," Hurry! If we miss this chance, we might not get another one!"
 Xiao, ...
Traveler, Xiao?
 Xiao, ...Stand back.
 Yanfei, ...!
Xiao," Now, we can avoid getting split up."
 Yelan, Oh?
Xiao, Thank you Xiao.
 Yanfei," A lot's happened here. But this wasn't just for our own safety. You're injured, we can't just leave you alone."
 Xiao, It's just a flesh wound. I am fine. I shouldn't let myself be a burden to you.
 Yanfei," You're not a burden. Don't think that for one second. We need you, all of us. For our sake, please, stay here. Please?"
 Xiao, Fine... As you wish.
 Yelan, You're injured. Get some rest. Everything else can wait.
Traveler," Yes, wait until you get better, Don't worry about anything else."
 Xiao, Alright.
Traveler, (Xiao has closed his eyes and seems to be resting... Could he be dreaming? This is quite astonishing.)
Traveler, (Is a yaksha who never lowers his guard capable of having dreams?)
Yanfei," Traveler, it looks like the Conqueror of Demons is awake."
Traveler, How do you feel?
 Xiao, ...I'm fine. Don't worry.
 Xiao, The karma I carry is dangerous to humans. Keep your distance.
 Yanfei," Well, I have adepti blood in me. So, I wouldn't worry too much."
 Xiao, ...Even so.
 Paimon, What happened while Paimon was sleeping? How did Xiao get here?
 Xiao," With a little help, I was able to find my way here."
Traveler, All thanks to Yanfei.
 Yanfei," Conqueror of Demons, could you tell us what happened before you joined us?"
 Xiao, No need to be so formal. Just call me Xiao.
 Yanfei," Oh, sure."
 Xiao, ...
 Xiao, It was a senseless battle.
 Xiao," I came here looking for someone, but when I found them... they weren't anything like how I expected."
 Yanfei, Madame Ping says that you usually base yourself at Wangshu Inn to guard the main road through Dihua Marsh. It's unusual for you to go looking for someone yourself... Are they an adeptus?
 Xiao, ...
 Xiao, I'm looking for a yaksha called Bosacius.
Traveler, (I'm sure I've heard that name somewhere before...)
 Yanfei," Bosacius... Is that one of the Five Yakshas, like you?"
 Yanfei, I thought that you were the only one left. Aren't the other four... gone from the world?
 Xiao, You could say that. But Bosacius's body is the only one that was never found.
 Xiao," Yakshas deal with god's remains all the time, and we become tainted by karma. Over time, it inevitably drives us to madness... The last time I saw Bosacius, it was the day he lost his mind."
 Xiao, He left. No one knew where he went and I never heard from him again.
 Xiao," But Bosacius was the eldest of us. He once told us, as Yakshas we will experience countless wars. Whether we live or die, we must promise to take care of each other and know each others' fate, to the very end."
 Yanfei, Did he forget his promise because he lost his sanity...
 Xiao, It's possible. But I did not.
 Xiao, I am the sole survivor. So it is my duty to find out the fates of the others.
 Paimon, What made you come to The Chasm? Did you hear something about Bosacius being here?
 Xiao," Did you know that five hundred years ago, the beasts of Khaenri'ah invaded The Chasm?"
Traveler, I've heard a thing or two.
 Xiao," That war lasted a long time. It is said that in the midst of the battle, a brave yaksha was seen putting up a heroic fight."
 Xiao, But no one knew the yaksha's name.
 Yanfei," But... there were many more than five yakshas in total, so there's no guarantee it was Bosacius."
 Paimon," Wow... But you must think it was probably him if you came here to investigate, right?"
 Xiao, I am by no means certain. And I didn't have any other clues except for this one.
 Xiao," But Bosacius was proud. If he had taken part in that war, he would have announced his name. So at first... I thought the nameless yaksha couldn't be him."
Traveler, ...You found Bosacius?
 Xiao, ...
 Yanfei," Wait, so it was Bosacius you were fighting with? Did he injure you?"
 Xiao, ...Yes.
 Paimon, No way...
 Yanfei," The invasion of monsters from Khaenri'ah, the battle in The Chasm, and Yelan's ancestor... I have a feeling that somehow, these are all connected."
 Yanfei," Life is full of coincidences, but this is too much of a coincidence. Could this all be related to the Fantastic Compass mentioned in the will, too?"
 Xiao, What will?
 Yanfei," Oh, right. I came here because of a will."
 Yanfei, Maybe it's not something you've come across much before? But both mortals and adepti sometimes write out their final wishes so somebody else will carry them out after they've passed. It's known as a last will and testament.
 Xiao, And this... can be done at any time?
 Paimon," Whoa, whoa, you wanna write a will now!?"
 Xiao, ...
 Xiao, It was no accident that you saw my illusion that day. This place used your desire to find me to create a trap that you would willingly walk into.
 Xiao," Pure deception is easy to spot, but the truth laced with lies can be a fatal combination. What you heard were really things that I said."
 Xiao, It made sure you heard my real voice to create panic. This one-way communication was the bait.
 Xiao," If we hadn't managed to get in touch through the spatial rift, we may well have lost someone by now. Rather than murdering in cold blood, this space seems more intent on consuming souls."
 Traveler, How is this even possible...
 Xiao, Our opponent is very clever. It is not safe to stay here.
 Xiao," Everyone, whether I accomplish what I came here to do or not, I must find a way to get you out safely."
 Yelan, ...
 Xiao, I rejoined to warn you that it's extremely dangerous here. If you stay here too long... this space may well devour you.
 Traveler, But how do you know?
 Xiao," ...You might become a shadow of your former self, wandering the underground like a lost soul."
 Yelan, Sounds like you saw them too...
 Yanfei," Yelan, you're back."
 Yelan, I've been back a while. I was listening to the conversation.
 Yelan," I've seen some strange things here, too. Objects that shouldn't be here, strange figures appearing then vanishing... I don't think any of it's real."
 Yanfei, So they're just illusions?
 Xiao," At first, I had the same thought."
 Xiao, But it's not that simple. There may come a day when these illusions become real and attack you.
 Yelan," From what you were saying a moment ago, it sounds like you know a way out of here?"
 Xiao, I can't say for sure... it's just a guess.
 Xiao," As Yanfei said, this space is chaotic and unstable, but it has its weaknesses. By attacking the point where both spaces connect, I was able to create a rift and move from one to the other."
 Xiao," So... If I use all the energy I have, I may be able to tear a passage out of this chaotic space."
 Yelan, Really... So powerful attacks can affect the space itself. I'd wondered if that was a possibility.
